{
  "id": "PRD-DEMO-2024",
  "title": "Smart Task Management Feature",
  "version": "1.0.0",
  "created_date": "2024-01-15",
  "owner": {
    "name": "Alex Johnson",
    "email": "alex.johnson@company.com",
    "team": "Product Team"
  },
  "status": "approved",
  "priority": "high",
  "overview": {
    "problem_statement": "Users struggle to prioritize and manage their daily tasks effectively, leading to decreased productivity and missed deadlines.",
    "solution_summary": "Implement an AI-powered task management system that automatically prioritizes tasks, suggests optimal scheduling, and provides intelligent reminders.",
    "target_audience": "Professionals and teams who manage multiple projects and tasks daily",
    "market_context": "Task management market is growing 15% annually with increasing demand for intelligent automation"
  },
  "objectives": {
    "business_goals": [
      "Increase user engagement by 30%",
      "Reduce task completion time by 25%",
      "Improve user retention rate by 20%"
    ],
    "success_metrics": [
      {
        "metric": "Daily Active Users",
        "target": "50% increase within 6 months",
        "measurement_method": "Analytics dashboard tracking"
      },
      {
        "metric": "Task Completion Rate",
        "target": "85% completion rate",
        "measurement_method": "User behavior analytics"
      }
    ]
  },
  "user_personas": [
    {
      "name": "Busy Professional",
      "description": "Mid-level manager juggling multiple projects and deadlines",
      "goals": [
        "Optimize daily schedule",
        "Never miss important deadlines",
        "Reduce time spent on task management"
      ],
      "pain_points": [
        "Too many competing priorities",
        "Difficulty estimating task duration",
        "Forgetting important tasks"
      ]
    }
  ],
  "user_stories": [
    {
      "id": "US-001",
      "story": "As a busy professional, I want the system to automatically prioritize my tasks so that I can focus on the most important work first",
      "acceptance_criteria": [
        "System analyzes task deadlines, importance, and dependencies",
        "Tasks are automatically reordered based on priority algorithm",
        "User can override automatic prioritization if needed"
      ],
      "priority": "must_have",
      "effort_estimate": "8 story points"
    },
    {
      "id": "US-002",
      "story": "As a team member, I want intelligent scheduling suggestions so that I can optimize my daily schedule",
      "acceptance_criteria": [
        "System considers my calendar availability",
        "Suggests optimal time blocks for different types of tasks",
        "Provides estimated completion times"
      ],
      "priority": "should_have",
      "effort_estimate": "5 story points"
    }
  ],
  "requirements": {
    "functional": [
      {
        "id": "FR-001",
        "description": "System shall provide automatic task prioritization based on deadline, importance, and dependencies",
        "priority": "must_have"
      },
      {
        "id": "FR-002",
        "description": "System shall integrate with calendar applications to suggest optimal scheduling",
        "priority": "should_have",
        "dependencies": [
          "FR-001"
        ]
      },
      {
        "id": "FR-003",
        "description": "System shall provide intelligent reminders and notifications",
        "priority": "must_have"
      }
    ],
    "non_functional": [
      {
        "id": "NFR-001",
        "category": "performance",
        "description": "Task prioritization algorithm must complete within 2 seconds",
        "acceptance_criteria": "Load testing shows 95th percentile response time \u003c 2 seconds"
      },
      {
        "id": "NFR-002",
        "category": "usability",
        "description": "Interface must be intuitive with minimal learning curve",
        "acceptance_criteria": "User testing shows 90% task completion rate without training"
      }
    ]
  },
  "technical_specifications": {
    "architecture_overview": "Microservices architecture with machine learning pipeline for intelligent prioritization and scheduling",
    "technology_stack": {
      "frontend": [
        "React",
        "TypeScript",
        "Tailwind CSS"
      ],
      "backend": [
        "Node.js",
        "Express",
        "Python ML services"
      ],
      "database": [
        "PostgreSQL",
        "Redis"
      ],
      "infrastructure": [
        "AWS",
        "Docker",
        "Kubernetes"
      ]
    },
    "security_considerations": [
      "End-to-end encryption for sensitive task data",
      "OAuth 2.0 authentication with major calendar providers",
      "GDPR compliance for user data handling"
    ]
  },
  "timeline": {
    "milestones": [
      {
        "name": "MVP Development",
        "description": "Core task management and basic prioritization",
        "target_date": "2024-03-15"
      },
      {
        "name": "AI Integration",
        "description": "Machine learning algorithm for intelligent prioritization",
        "target_date": "2024-04-30",
        "dependencies": [
          "MVP Development"
        ]
      },
      {
        "name": "Calendar Integration",
        "description": "Integration with Google Calendar, Outlook, and Apple Calendar",
        "target_date": "2024-06-01",
        "dependencies": [
          "AI Integration"
        ]
      }
    ],
    "launch_date": "2024-07-15"
  },
  "risks_and_assumptions": {
    "risks": [
      {
        "description": "Machine learning algorithm may not achieve target accuracy",
        "impact": "medium",
        "probability": "low",
        "mitigation_strategy": "Extensive training data collection and algorithm tuning"
      },
      {
        "description": "Calendar API limitations may restrict functionality",
        "impact": "high",
        "probability": "medium",
        "mitigation_strategy": "Early API testing and fallback solutions"
      }
    ],
    "assumptions": [
      "Users are willing to grant calendar access permissions",
      "Third-party APIs will remain stable during development",
      "User adoption of AI-suggested prioritization will be high"
    ]
  },
  "out_of_scope": [
    "Project management features (Gantt charts, resource allocation)",
    "Team collaboration tools (chat, file sharing)",
    "Mobile app (planned for Phase 2)"
  ]
}