{
  "id": "PRD-001",
  "title": "Mobile App User Authentication System",
  "version": "1.0.0",
  "created_date": "2024-01-15",
  "last_updated": "2024-01-20T10:30:00Z",
  "owner": {
    "name": "Jane Smith",
    "email": "jane.smith@company.com",
    "team": "Product Team"
  },
  "stakeholders": [
    {
      "name": "John Doe",
      "email": "john.doe@company.com",
      "role": "stakeholder",
      "team": "Engineering"
    },
    {
      "name": "Sarah Wilson",
      "email": "sarah.wilson@company.com",
      "role": "reviewer",
      "team": "Security"
    }
  ],
  "status": "approved",
  "priority": "high",
  "overview": {
    "problem_statement": "Users currently face difficulties with the manual login process, leading to poor user experience and high abandonment rates during onboarding.",
    "solution_summary": "Implement a modern, secure authentication system with biometric login, social login options, and streamlined user registration flow.",
    "target_audience": "Mobile app users aged 18-65 who value convenience and security",
    "market_context": "Competitors offer biometric authentication; we need this feature to remain competitive"
  },
  "objectives": {
    "business_goals": [
      "Reduce user onboarding abandonment rate by 30%",
      "Increase user engagement by improving login experience",
      "Enhance security posture of the application"
    ],
    "success_metrics": [
      {
        "metric": "Login Success Rate",
        "target": "95%",
        "measurement_method": "Analytics tracking of successful vs failed login attempts"
      },
      {
        "metric": "User Onboarding Completion",
        "target": "80%",
        "measurement_method": "Funnel analysis from registration start to completion"
      }
    ],
    "okrs": [
      {
        "objective": "Improve user authentication experience",
        "key_results": [
          "Achieve 95% login success rate",
          "Reduce average login time to under 10 seconds",
          "Implement biometric authentication for 70% of supported devices"
        ]
      }
    ]
  },
  "user_personas": [
    {
      "name": "Tech-Savvy Sarah",
      "description": "25-year-old professional who values efficiency and modern technology",
      "goals": [
        "Quick and secure access to the app",
        "Seamless user experience across devices"
      ],
      "pain_points": [
        "Remembering complex passwords",
        "Time-consuming login processes"
      ]
    }
  ],
  "user_stories": [
    {
      "id": "US-001",
      "story": "As a mobile app user, I want to log in using my fingerprint so that I can access the app quickly and securely",
      "acceptance_criteria": [
        "User can enable biometric authentication in settings",
        "Fingerprint login works on supported devices",
        "Fallback to password is available if biometric fails"
      ],
      "priority": "must_have",
      "effort_estimate": "8 story points"
    },
    {
      "id": "US-002",
      "story": "As a new user, I want to register using my Google account so that I don't have to create another password",
      "acceptance_criteria": [
        "Google OAuth integration is implemented",
        "User profile is created automatically from Google account",
        "Terms and conditions acceptance is required"
      ],
      "priority": "should_have",
      "effort_estimate": "5 story points"
    }
  ],
  "requirements": {
    "functional": [
      {
        "id": "FR-001",
        "description": "System shall support biometric authentication (fingerprint, face recognition) on compatible devices",
        "priority": "must_have",
        "dependencies": []
      },
      {
        "id": "FR-002",
        "description": "System shall provide social login options (Google, Apple, Facebook)",
        "priority": "should_have",
        "dependencies": ["FR-001"]
      },
      {
        "id": "FR-003",
        "description": "System shall implement password reset functionality via email",
        "priority": "must_have",
        "dependencies": []
      }
    ],
    "non_functional": [
      {
        "id": "NFR-001",
        "category": "security",
        "description": "All authentication data must be encrypted in transit and at rest",
        "acceptance_criteria": "Use TLS 1.3 for data in transit and AES-256 for data at rest"
      },
      {
        "id": "NFR-002",
        "category": "performance",
        "description": "Login process should complete within 5 seconds under normal conditions",
        "acceptance_criteria": "95th percentile response time < 5 seconds"
      },
      {
        "id": "NFR-003",
        "category": "usability",
        "description": "Authentication UI should be accessible to users with disabilities",
        "acceptance_criteria": "Comply with WCAG 2.1 Level AA standards"
      }
    ]
  },
  "technical_specifications": {
    "architecture_overview": "Client-server architecture with OAuth 2.0 and JWT token-based authentication",
    "technology_stack": {
      "frontend": ["React Native", "TypeScript"],
      "backend": ["Node.js", "Express.js", "Passport.js"],
      "database": ["PostgreSQL", "Redis"],
      "infrastructure": ["AWS ECS", "AWS RDS", "AWS ElastiCache"]
    },
    "api_specifications": [
      {
        "endpoint": "/api/auth/login",
        "method": "POST",
        "description": "Authenticate user with credentials",
        "request_format": "JSON with email/password or OAuth token",
        "response_format": "JSON with JWT token and user profile"
      },
      {
        "endpoint": "/api/auth/biometric",
        "method": "POST",
        "description": "Authenticate user with biometric data",
        "request_format": "JSON with biometric hash and user ID",
        "response_format": "JSON with JWT token"
      }
    ],
    "security_considerations": [
      "Implement rate limiting to prevent brute force attacks",
      "Use secure storage for biometric templates",
      "Implement proper session management",
      "Regular security audits and penetration testing"
    ]
  },
  "timeline": {
    "milestones": [
      {
        "name": "Design and Architecture Complete",
        "description": "Finalized UI/UX designs and technical architecture",
        "target_date": "2024-02-15",
        "dependencies": []
      },
      {
        "name": "Backend API Development",
        "description": "Core authentication APIs implemented and tested",
        "target_date": "2024-03-15",
        "dependencies": ["Design and Architecture Complete"]
      },
      {
        "name": "Mobile App Integration",
        "description": "Frontend integration with authentication APIs",
        "target_date": "2024-04-01",
        "dependencies": ["Backend API Development"]
      },
      {
        "name": "Beta Testing",
        "description": "Internal testing and bug fixes",
        "target_date": "2024-04-15",
        "dependencies": ["Mobile App Integration"]
      }
    ],
    "launch_date": "2024-05-01"
  },
  "risks_and_assumptions": {
    "risks": [
      {
        "description": "Biometric API changes in mobile OS updates",
        "impact": "medium",
        "probability": "low",
        "mitigation_strategy": "Monitor OS beta releases and maintain fallback authentication methods"
      },
      {
        "description": "Security vulnerability discovered during development",
        "impact": "high",
        "probability": "medium",
        "mitigation_strategy": "Conduct regular security reviews and penetration testing"
      }
    ],
    "assumptions": [
      "Users have devices that support biometric authentication",
      "Third-party OAuth providers maintain API stability",
      "Network connectivity is available for authentication"
    ]
  },
  "out_of_scope": [
    "Multi-factor authentication (MFA) - planned for v2.0",
    "Enterprise SSO integration",
    "Advanced fraud detection algorithms"
  ],
  "appendices": {
    "research_data": "User research conducted in Q4 2023 shows 85% of users prefer biometric authentication",
    "mockups_wireframes": [
      {
        "name": "Login Screen Mockup",
        "url": "https://figma.com/mockup-login-screen",
        "description": "Visual design for the new login interface"
      }
    ],
    "related_documents": [
      {
        "title": "Security Architecture Document",
        "url": "https://docs.company.com/security-arch",
        "type": "technical_spec"
      },
      {
        "title": "User Research Report Q4 2023",
        "url": "https://docs.company.com/user-research-q4",
        "type": "market_research"
      }
    ]
  }
}